{
    "normalized_result_id":  "NRR-20260731-155326-8E835F",
    "execution_id":  "EXE-20260731-155326-396EED",
    "bridge_request_id":  "BRQ-20260731-155326-0605A4",
    "message_id":  "MSG-20260731-155326-F70D5B",
    "status":  "completed",
    "created_at":  "2026-07-31T15:53:26.5243138-05:00",
    "summary":  "Offline OpenClaw Bridge certification completed.",
    "data":  {
                 "run_id":  "RUN-OFFLINE-CERTIFICATION",
                 "session_key":  "ai-office-bridge-certification",
                 "gateway_url":  "ws://localhost:18789",
                 "started_at":  "2026-07-31T15:53:26.4783146-05:00",
                 "completed_at":  "2026-07-31T15:53:26.4783146-05:00",
                 "response_payload":  {
                                          "summary":  "Offline OpenClaw Bridge certification completed.",
                                          "status":  "success"
                                      },
                 "error":  null
             },
    "artifacts":  [

                  ]
}
